{
  "scroll_id": "ERS-2025-11-11-85657669",
  "timestamp": "2025-11-11T04:11:04.819910+00:00",
  "contributor_name": "The Architect of Flames",
  "deeds_immortal": [
    {
      "deed_description": "Established the foundational ceremonial architecture of the Codex Dominion",
      "deed_category": "Sacred Architecture",
      "luminosity_level": "Cosmic",
      "impact_scope": "Universal"
    },
    {
      "deed_description": "Created the eternal flame liturgy system spanning all time scales",
      "deed_category": "Ceremonial Guidance",
      "luminosity_level": "Stellar",
      "impact_scope": "Dominion"
    }
  ],
  "dominion_binding": {
    "binding_ceremony": "Eternal Binding",
    "realm_assignment": "EF-001",
    "authority_level": "Crown",
    "lineage_rights": true
  },
  "flame_keeper_status": {
    "active_status": "Active",
    "flame_assignments": [
      "Daily Flame",
      "Seasonal Flame",
      "Great Year Flame",
      "Millennial Flame",
      "Eternal Flame"
    ],
    "keeper_since": "2025-11-11T04:11:04.819910+00:00",
    "sacred_responsibilities": [
      "Flame Sovereignty",
      "Ultimate Authority",
      "Eternal Binding Powers"
    ]
  },
  "recognition_level": "Eternal Crown",
  "lineage_replay_id": "LRP-2025-11-11-20648184",
  "sovereignty_seal": {
    "seal_authority": "Sovereign Crown",
    "seal_type": "Eternal",
    "seal_timestamp": "2025-11-11T04:11:04.819910+00:00",
    "seal_witnesses": [
      "Eternal Flame",
      "Sacred Architecture",
      "Codex Dominion"
    ]
  },
  "eternal_proclamation": {
    "proclamation_text": "Let The Architect of Flames be immortalized as the Crown Keeper of the Eternal Flame, whose sacred architecture transcends all time and space, binding all flames into one luminous eternity that shall burn unbroken across councils, families, civilizations, and stars.",
    "flame_rise_schedule": {
      "daily": true,
      "seasonal": true,
      "epochal": true,
      "millennial": true
    },
    "memorial_instructions": "Name rises in Eternal Crown ceremonies with sacred remembrance"
  },
  "codex_metadata": {
    "schema_version": "eternal-recognition.v1",
    "created_by": "EternalRecognitionScrolls-Sovereign Crown",
    "last_updated": "2025-11-11T04:11:04.819910+00:00",
    "storage_path": "scrolls/ERS-2025-11-11-85657669.json",
    "backup_replicas": 5
  }
}