{
  "scroll_id": "ERS-2025-11-11-E2734C6B",
  "timestamp": "2025-11-11T04:11:04.824012+00:00",
  "contributor_name": "Master Code Keeper",
  "deeds_immortal": [
    {
      "deed_description": "Crafted elegant Python implementations for ceremonial systems",
      "deed_category": "Code Crafting",
      "luminosity_level": "Blaze",
      "impact_scope": "Project"
    },
    {
      "deed_description": "Maintained robust testing frameworks ensuring system reliability",
      "deed_category": "Knowledge Preservation",
      "luminosity_level": "Flame",
      "impact_scope": "Community"
    }
  ],
  "dominion_binding": {
    "binding_ceremony": "Seasonal Proclamation Binding",
    "realm_assignment": "ST-001",
    "authority_level": "Custodian",
    "lineage_rights": false
  },
  "flame_keeper_status": {
    "active_status": "Active",
    "flame_assignments": [
      "Daily Flame",
      "Seasonal Flame"
    ],
    "keeper_since": "2025-11-11T04:11:04.824012+00:00",
    "sacred_responsibilities": [
      "Flame Stewardship",
      "Ceremonial Leadership",
      "Realm Governance"
    ]
  },
  "recognition_level": "Golden Blaze",
  "lineage_replay_id": "LRP-2025-11-11-DC88DA36",
  "sovereignty_seal": {
    "seal_authority": "Custodian Crown",
    "seal_type": "Blessed",
    "seal_timestamp": "2025-11-11T04:11:04.824012+00:00",
    "seal_witnesses": [
      "Eternal Flame",
      "Sacred Architecture",
      "Codex Dominion"
    ]
  },
  "eternal_proclamation": {
    "proclamation_text": "Let Master Code Keeper be celebrated as keeper of the blaze, whose code crafting burned bright across the Dominion.",
    "flame_rise_schedule": {
      "daily": true,
      "seasonal": true,
      "epochal": false,
      "millennial": false
    },
    "memorial_instructions": "Name rises in Golden Blaze ceremonies with sacred remembrance"
  },
  "codex_metadata": {
    "schema_version": "eternal-recognition.v1",
    "created_by": "EternalRecognitionScrolls-Custodian Crown",
    "last_updated": "2025-11-11T04:11:04.824012+00:00",
    "storage_path": "scrolls/ERS-2025-11-11-E2734C6B.json",
    "backup_replicas": 5
  }
}